[
  {
    "id": "dima",
    "name": "Dima",
    "kind": "player",
    "addressAs": "none",
    "voice": { "engine": "none", "id": "none" },
    "sprite": "dima",
    "portrait": "dima",
    "hearts": false
  },
  {
    "id": "bobr",
    "name": "Kazimierz Bóbr",
    "kind": "companion",
    "addressAs": "ty",
    "voice": { "engine": "none", "id": "none" },
    "sprite": "bobr",
    "portrait": "bobr",
    "traits": "Kazik, бобр с Буга, прораб: короткие команды, «Szefie!», «Prawie. Jeszcze raz.» Всё объясняет стройкой. Не читает, грызёт. Строит мост.",
    "hearts": false
  },
  {
    "id": "simba",
    "name": "Simba",
    "kind": "secret",
    "addressAs": "none",
    "voice": { "engine": "none", "id": "none" },
    "sprite": "simba",
    "portrait": "simba",
    "hearts": false
  },
  {
    "id": "brzechwa",
    "name": "Jan Brzechwa",
    "kind": "teacher",
    "years": "1898–1966",
    "addressAs": "ty",
    "voice": { "engine": "say", "id": "Zosia" },
    "sprite": "brzechwa",
    "portrait": "brzechwa",
    "traits": "Поэт скороговорок, весёлый и нетерпеливый, адвокат по авторскому праву. Перебивает «Powtórz!», рифмует имена. Портрет-заглушка до I-26."
  },
  {
    "id": "pan_marek",
    "name": "pan Marek",
    "kind": "extra",
    "addressAs": "pan",
    "voice": { "engine": "say", "id": "Zosia" },
    "sprite": "extra_m",
    "portrait": "extra_m",
    "traits": "Бариста, кофейная тележка в переходе метро. Вечное «Już, już!»."
  },
  {
    "id": "pani_hela",
    "name": "pani Hela",
    "kind": "extra",
    "addressAs": "pani",
    "voice": { "engine": "say", "id": "Zosia" },
    "sprite": "extra_k",
    "portrait": "extra_k",
    "traits": "Продавщица с Bazaru Różyckiego, лоток со старьём (вступление).",
    "hearts": false
  },
  {
    "id": "konduktor",
    "name": "Konduktor",
    "kind": "extra",
    "addressAs": "pan",
    "voice": { "engine": "say", "id": "Zosia" },
    "sprite": "extra_m",
    "portrait": "extra_m",
    "traits": "Старомодный контролёр в фуражке, босс главы 1: «Bilety do kontroli!».",
    "hearts": false
  },
  {
    "id": "pasazer",
    "name": "Pasażer",
    "kind": "extra",
    "addressAs": "pan",
    "voice": { "engine": "say", "id": "Zosia" },
    "sprite": "extra_m",
    "portrait": "extra_m",
    "traits": "Пассажир в вагоне метро (сцена 1.4).",
    "hearts": false
  },
  {
    "id": "pani_basia",
    "name": "pani Basia",
    "kind": "extra",
    "addressAs": "pani",
    "voice": { "engine": "say", "id": "Zosia" },
    "sprite": "extra_k",
    "portrait": "extra_k",
    "traits": "Соседка, 70+, хозяйка działki, колено «tak sobie». Главный источник заказов. «Zawsze jest miejsce dla gościa.»"
  },
  {
    "id": "ola",
    "name": "Ola",
    "kind": "extra",
    "addressAs": "ty",
    "voice": { "engine": "say", "id": "Zosia" },
    "sprite": "extra_k",
    "portrait": "extra_k",
    "traits": "Сестра Каси, камео (бывшая проводница из черновика методиста). Сцена 1.8.",
    "hearts": false
  },
  {
    "id": "kasia",
    "name": "Kasia",
    "kind": "extra",
    "addressAs": "ty",
    "voice": { "engine": "say", "id": "Zosia" },
    "sprite": "extra_k",
    "portrait": "extra_k",
    "traits": "28 лет, из Кракова, только на «ty». Будущая коллега по коворкингу (гл. 3); в гл. 1 знакомство в сцене 1.8."
  },
  {
    "id": "urzedniczka",
    "name": "Urzędniczka",
    "kind": "extra",
    "addressAs": "pani",
    "voice": { "engine": "say", "id": "Zosia" },
    "sprite": "extra_k",
    "portrait": "extra_k",
    "traits": "Окошко ZTM, именной проездной: numerek 147, «obsługujemy: 12». Сцена 1.12.",
    "hearts": false
  }
]
